{
  "$schema": "./catalog.schema.json",
  "schemaVersion": "1.0.0",
  "version": "0.1.0",
  "name": "Scudamore's UI",
  "components": [
    {
      "id": "accordion",
      "title": "Accordion",
      "category": "disclosure",
      "kind": "component",
      "maturity": "beta",
      "manifest": "catalog/components/accordion.json",
      "frameworks": [
        "react",
        "blade"
      ],
      "searchTerms": [
        "accordion",
        "disclosure",
        "expand"
      ]
    },
    {
      "id": "alert",
      "title": "Alert",
      "category": "feedback",
      "kind": "component",
      "maturity": "stable",
      "manifest": "catalog/components/alert.json",
      "frameworks": [
        "react",
        "blade"
      ],
      "searchTerms": [
        "alert",
        "message",
        "feedback"
      ]
    },
    {
      "id": "alert-dialog",
      "title": "Alert Dialog",
      "category": "overlays",
      "kind": "component",
      "maturity": "stable",
      "manifest": "catalog/components/alert-dialog.json",
      "frameworks": [
        "react",
        "blade"
      ],
      "searchTerms": [
        "alert dialog",
        "confirm",
        "modal"
      ]
    },
    {
      "id": "aspect-ratio",
      "title": "Aspect Ratio",
      "category": "layout",
      "kind": "component",
      "maturity": "beta",
      "manifest": "catalog/components/aspect-ratio.json",
      "frameworks": [
        "react",
        "blade"
      ],
      "searchTerms": [
        "aspect ratio",
        "media",
        "responsive"
      ]
    },
    {
      "id": "avatar",
      "title": "Avatar",
      "category": "data-display",
      "kind": "component",
      "maturity": "beta",
      "manifest": "catalog/components/avatar.json",
      "frameworks": [
        "react",
        "blade"
      ],
      "searchTerms": [
        "avatar",
        "profile",
        "initials"
      ]
    },
    {
      "id": "badge",
      "title": "Badge",
      "category": "data-display",
      "kind": "component",
      "maturity": "stable",
      "manifest": "catalog/components/badge.json",
      "frameworks": [
        "react",
        "blade"
      ],
      "searchTerms": [
        "badge",
        "status",
        "pill"
      ]
    },
    {
      "id": "breadcrumb",
      "title": "Breadcrumb",
      "category": "navigation",
      "kind": "component",
      "maturity": "beta",
      "manifest": "catalog/components/breadcrumb.json",
      "frameworks": [
        "react",
        "blade"
      ],
      "searchTerms": [
        "breadcrumb",
        "navigation",
        "hierarchy"
      ]
    },
    {
      "id": "button",
      "title": "Button",
      "category": "actions",
      "kind": "component",
      "maturity": "stable",
      "manifest": "catalog/components/button.json",
      "frameworks": [
        "react",
        "blade"
      ],
      "searchTerms": [
        "button",
        "action",
        "link"
      ]
    },
    {
      "id": "calendar",
      "title": "Calendar",
      "category": "forms",
      "kind": "component",
      "maturity": "stable",
      "manifest": "catalog/components/calendar.json",
      "frameworks": [
        "react",
        "blade"
      ],
      "searchTerms": [
        "calendar",
        "date",
        "range"
      ]
    },
    {
      "id": "card",
      "title": "Card",
      "category": "data-display",
      "kind": "component",
      "maturity": "stable",
      "manifest": "catalog/components/card.json",
      "frameworks": [
        "react",
        "blade"
      ],
      "searchTerms": [
        "card",
        "surface",
        "panel"
      ]
    },
    {
      "id": "checkbox",
      "title": "Checkbox",
      "category": "forms",
      "kind": "component",
      "maturity": "stable",
      "manifest": "catalog/components/checkbox.json",
      "frameworks": [
        "react",
        "blade"
      ],
      "searchTerms": [
        "checkbox",
        "checked",
        "indeterminate"
      ]
    },
    {
      "id": "collapsible",
      "title": "Collapsible",
      "category": "disclosure",
      "kind": "component",
      "maturity": "stable",
      "manifest": "catalog/components/collapsible.json",
      "frameworks": [
        "react",
        "blade"
      ],
      "searchTerms": [
        "collapsible",
        "disclosure",
        "expand"
      ]
    },
    {
      "id": "dialog",
      "title": "Dialog",
      "category": "overlays",
      "kind": "component",
      "maturity": "stable",
      "manifest": "catalog/components/dialog.json",
      "frameworks": [
        "react",
        "blade"
      ],
      "searchTerms": [
        "dialog",
        "modal",
        "overlay"
      ]
    },
    {
      "id": "dropdown-menu",
      "title": "Dropdown Menu",
      "category": "overlays",
      "kind": "component",
      "maturity": "stable",
      "manifest": "catalog/components/dropdown-menu.json",
      "frameworks": [
        "react",
        "blade"
      ],
      "searchTerms": [
        "dropdown",
        "menu",
        "actions"
      ]
    },
    {
      "id": "form",
      "title": "Form",
      "category": "forms",
      "kind": "component",
      "maturity": "beta",
      "manifest": "catalog/components/form.json",
      "frameworks": [
        "react",
        "blade"
      ],
      "searchTerms": [
        "form",
        "validation",
        "field"
      ]
    },
    {
      "id": "input",
      "title": "Input",
      "category": "forms",
      "kind": "component",
      "maturity": "stable",
      "manifest": "catalog/components/input.json",
      "frameworks": [
        "react",
        "blade"
      ],
      "searchTerms": [
        "input",
        "field",
        "text"
      ]
    },
    {
      "id": "input-otp",
      "title": "Input OTP",
      "category": "forms",
      "kind": "component",
      "maturity": "stable",
      "manifest": "catalog/components/input-otp.json",
      "frameworks": [
        "react",
        "blade"
      ],
      "searchTerms": [
        "otp",
        "verification",
        "code"
      ]
    },
    {
      "id": "label",
      "title": "Label",
      "category": "forms",
      "kind": "component",
      "maturity": "stable",
      "manifest": "catalog/components/label.json",
      "frameworks": [
        "react",
        "blade"
      ],
      "searchTerms": [
        "label",
        "form",
        "caption"
      ]
    },
    {
      "id": "page-container",
      "title": "Page Container",
      "category": "layout",
      "kind": "component",
      "maturity": "stable",
      "manifest": "catalog/components/page-container.json",
      "frameworks": [
        "react",
        "blade"
      ],
      "searchTerms": [
        "page container",
        "layout",
        "gutter"
      ]
    },
    {
      "id": "page-header",
      "title": "Page Header",
      "category": "layout",
      "kind": "component",
      "maturity": "stable",
      "manifest": "catalog/components/page-header.json",
      "frameworks": [
        "react",
        "blade"
      ],
      "searchTerms": [
        "page header",
        "title",
        "actions"
      ]
    },
    {
      "id": "pagination",
      "title": "Pagination",
      "category": "navigation",
      "kind": "component",
      "maturity": "beta",
      "manifest": "catalog/components/pagination.json",
      "frameworks": [
        "react",
        "blade"
      ],
      "searchTerms": [
        "pagination",
        "pages",
        "navigation"
      ]
    },
    {
      "id": "popover",
      "title": "Popover",
      "category": "overlays",
      "kind": "component",
      "maturity": "stable",
      "manifest": "catalog/components/popover.json",
      "frameworks": [
        "react",
        "blade"
      ],
      "searchTerms": [
        "popover",
        "floating",
        "overlay"
      ]
    },
    {
      "id": "progress",
      "title": "Progress",
      "category": "feedback",
      "kind": "component",
      "maturity": "beta",
      "manifest": "catalog/components/progress.json",
      "frameworks": [
        "react",
        "blade"
      ],
      "searchTerms": [
        "progress",
        "completion",
        "loading"
      ]
    },
    {
      "id": "radio-group",
      "title": "Radio Group",
      "category": "forms",
      "kind": "component",
      "maturity": "stable",
      "manifest": "catalog/components/radio-group.json",
      "frameworks": [
        "react",
        "blade"
      ],
      "searchTerms": [
        "radio",
        "choice",
        "group"
      ]
    },
    {
      "id": "scroll-area",
      "title": "Scroll Area",
      "category": "layout",
      "kind": "component",
      "maturity": "stable",
      "manifest": "catalog/components/scroll-area.json",
      "frameworks": [
        "react",
        "blade"
      ],
      "searchTerms": [
        "scroll area",
        "overflow",
        "viewport"
      ]
    },
    {
      "id": "select",
      "title": "Select",
      "category": "forms",
      "kind": "component",
      "maturity": "stable",
      "manifest": "catalog/components/select.json",
      "frameworks": [
        "react",
        "blade"
      ],
      "searchTerms": [
        "select",
        "option",
        "dropdown"
      ]
    },
    {
      "id": "separator",
      "title": "Separator",
      "category": "layout",
      "kind": "component",
      "maturity": "stable",
      "manifest": "catalog/components/separator.json",
      "frameworks": [
        "react",
        "blade"
      ],
      "searchTerms": [
        "separator",
        "divider",
        "rule"
      ]
    },
    {
      "id": "sheet",
      "title": "Sheet",
      "category": "overlays",
      "kind": "component",
      "maturity": "stable",
      "manifest": "catalog/components/sheet.json",
      "frameworks": [
        "react",
        "blade"
      ],
      "searchTerms": [
        "sheet",